nohup: ignoring input
[GPU] PyTorch3D loaded - GPU raycasting AVAILABLE (FAST MODE: bin_size=None)
[GPU] PyTorch3D loaded - GPU raycasting AVAILABLE (will be enabled via --raycasting arg)
Auto-detected latest checkpoint: last.ckpt

Loading model from: /autofs/space/ballarat_004/users/np341/PRIR_Code/Training/White/Models_WM_Conditioned_V2_1view_7711474/last.ckpt
✓ Model loaded (using TRAIN mode due to corrupted BN running stats)

================================================================================
Testing VIEW-CONDITIONED model V2 with PyTorch3D pipeline
Checkpoint: /autofs/space/ballarat_004/users/np341/PRIR_Code/Training/White/Models_WM_Conditioned_V2_1view_7711474/last.ckpt
Test data: /autofs/space/ballarat_004/users/np341/mindboggle2
1. Generate predictions using V2 model (one-hot view encoding)
2. Iterative smoothing (α=0.75, 20 iter)
3. MRF with ICM (β=0.1)
================================================================================

Found 101 test subjects

================================================================================
Subject: Afterthought-1
================================================================================
  Step 0: Generating predictions with V2 model...
  Mesh: 130921 vertices, 261838 faces
  Rendering 6 canonical views with PyTorch3D...
  [PyTorch3D] Starting raycasting...
  [PyTorch3D] Using device: cuda:0
  [PyTorch3D] Loading mesh data...
  [PyTorch3D] Mesh: 130921 vertices, 261838 faces
  [PyTorch3D] Uploading mesh to GPU...
  [PyTorch3D] Computing face normals...
  [PyTorch3D] Computing camera matrices...
  [PyTorch3D] Processing 6 views (canonical, no augmentation)...
  [PyTorch3D] Rendering view 1/6: Front... Done! (52544 valid pixels)
  [PyTorch3D] Rendering view 2/6: Bottom... Done! (102793 valid pixels)
  [PyTorch3D] Rendering view 3/6: Top... Done! (94972 valid pixels)
  [PyTorch3D] Rendering view 4/6: Right... Done! (67847 valid pixels)
  [PyTorch3D] Rendering view 5/6: Back... Done! (47950 valid pixels)
  [PyTorch3D] Rendering view 6/6: Left... Done! (72380 valid pixels)
  [PyTorch3D] Raycasting complete!
  Generating predictions for 6 views (one-hot encoded)...
    ✓ Front (view_id=0): shape (37, 800, 800)
      Valid pixels: 52544/640000 (8.2%)
      Probs stats: min=0.0000, max=1.0000, mean=0.0270
      Face IDs: min=0, max=261300, num_faces=261838
      Valid probs shape: (37, 52544)
    ✓ Bottom (view_id=5): shape (37, 800, 800)
      Valid pixels: 102793/640000 (16.1%)
      Probs stats: min=0.0000, max=0.9999, mean=0.0270
      Face IDs: min=1, max=261837, num_faces=261838
      Valid probs shape: (37, 102793)
    ✓ Top (view_id=4): shape (37, 800, 800)
      Valid pixels: 94972/640000 (14.8%)
      Probs stats: min=0.0000, max=0.9999, mean=0.0270
      Face IDs: min=11, max=261835, num_faces=261838
      Valid probs shape: (37, 94972)
    ✓ Right (view_id=3): shape (37, 800, 800)
      Valid pixels: 67847/640000 (10.6%)
      Probs stats: min=0.0000, max=1.0000, mean=0.0270
      Face IDs: min=11, max=261746, num_faces=261838
      Valid probs shape: (37, 67847)
    ✓ Back (view_id=1): shape (37, 800, 800)
      Valid pixels: 47950/640000 (7.5%)
      Probs stats: min=0.0000, max=1.0000, mean=0.0270
      Face IDs: min=3568, max=261837, num_faces=261838
      Valid probs shape: (37, 47950)
    ✓ Left (view_id=2): shape (37, 800, 800)
      Valid pixels: 72380/640000 (11.3%)
      Probs stats: min=0.0000, max=1.0000, mean=0.0270
      Face IDs: min=34, max=261836, num_faces=261838
      Valid probs shape: (37, 72380)
    P stats: min=0.0000, max=1.0000, mean=0.0200
    Non-zero vertices: 96668/130921
  ✓ Aggregation complete
  Predicted Labels Distribution:
    Unique pred_raw labels: [ 0  1  2  3  5  6  7  8  9 10 11 12 13 14 15 16 17 18 19 20 21 22 23 24
 25 26 27 28 29 30 31 32 33 34 35]
    Pred label counts: [    0 34253   668   757  3336     0  1494   820  3118  4879]
  Ground Truth Stats:
    Labels shape: (130921,)
    Unique labels: [-1  1  2  3  5  6  7  8  9 10 11 12 13 14 15 16 17 18 19 20 21 22 23 24
 25 26 27 28 29 30 31 32 33 34 35]
    CTab len: 36
  ✓ Raw prediction saved to: /autofs/space/ballarat_004/users/np341/mindboggle2/Afterthought-1/pred_conditioned_v2_pytorch3d
  Building vertex adjacency...
  Step 1: Smoothing probabilities (20 iter, α=0.75)...
    Smoothing iteration 0/20...
    Smoothing iteration 5/20...
    Smoothing iteration 10/20...
    Smoothing iteration 15/20...
  ✓ Smoothing complete
  Step 2: MRF refinement (β=0.1)...
    MRF iteration 1/5...
    MRF iteration 2/5...
    MRF iteration 3/5...
  ✓ MRF refinement complete
    Dice calculation debug:
      Pred labels: min=0, max=35, unique=35
      GT labels:   min=-1, max=35, unique=35
      Computed 35 valid scores. Mean: 0.7050
    Dice calculation debug:
      Pred labels: min=1, max=35, unique=34
      GT labels:   min=-1, max=35, unique=35
      Computed 34 valid scores. Mean: 0.8435
    Dice calculation debug:
      Pred labels: min=1, max=35, unique=34
      GT labels:   min=-1, max=35, unique=35
      Computed 34 valid scores. Mean: 0.8437

  RESULTS:
  RAW:         median(top-10)=0.8455, mean(top-10)=0.8486, median(all)=0.7661, mean(all)=0.7050
  + SMOOTHING: median(top-10)=0.9337, mean(top-10)=0.9297, median(all)=0.8855, mean(all)=0.8435 [+0.0882]
  + MRF:       median(top-10)=0.9333, mean(top-10)=0.9298, median(all)=0.8856, mean(all)=0.8437 [-0.0003]
  TOTAL IMPROVEMENT (median top-10): +0.0879

================================================================================
Subject: Colin27-1
================================================================================
  Step 0: Generating predictions with V2 model...
  Mesh: 182414 vertices, 364824 faces
  Rendering 6 canonical views with PyTorch3D...
  [PyTorch3D] Starting raycasting...
  [PyTorch3D] Using device: cuda:0
  [PyTorch3D] Loading mesh data...
  [PyTorch3D] Mesh: 182414 vertices, 364824 faces
  [PyTorch3D] Uploading mesh to GPU...
  [PyTorch3D] Computing face normals...
  [PyTorch3D] Computing camera matrices...
  [PyTorch3D] Processing 6 views (canonical, no augmentation)...
  [PyTorch3D] Rendering view 1/6: Front... Done! (43071 valid pixels)
  [PyTorch3D] Rendering view 2/6: Bottom... Done! (97725 valid pixels)
  [PyTorch3D] Rendering view 3/6: Top... Done! (89326 valid pixels)
  [PyTorch3D] Rendering view 4/6: Right... Done! (56504 valid pixels)
  [PyTorch3D] Rendering view 5/6: Back... Done! (42980 valid pixels)
  [PyTorch3D] Rendering view 6/6: Left... Done! (61050 valid pixels)
  [PyTorch3D] Raycasting complete!
  Generating predictions for 6 views (one-hot encoded)...
    ✓ Front (view_id=0): shape (37, 800, 800)
      Valid pixels: 43071/640000 (6.7%)
      Probs stats: min=0.0000, max=1.0000, mean=0.0270
      Face IDs: min=0, max=364539, num_faces=364824
      Valid probs shape: (37, 43071)
    ✓ Bottom (view_id=5): shape (37, 800, 800)
      Valid pixels: 97725/640000 (15.3%)
      Probs stats: min=0.0000, max=1.0000, mean=0.0270
      Face IDs: min=96, max=364820, num_faces=364824
      Valid probs shape: (37, 97725)
    ✓ Top (view_id=4): shape (37, 800, 800)
      Valid pixels: 89326/640000 (14.0%)
      Probs stats: min=0.0000, max=1.0000, mean=0.0270
      Face IDs: min=8, max=364541, num_faces=364824
      Valid probs shape: (37, 89326)
    ✓ Right (view_id=3): shape (37, 800, 800)
      Valid pixels: 56504/640000 (8.8%)
      Probs stats: min=0.0000, max=1.0000, mean=0.0270
      Face IDs: min=2, max=364669, num_faces=364824
      Valid probs shape: (37, 56504)
    ✓ Back (view_id=1): shape (37, 800, 800)
      Valid pixels: 42980/640000 (6.7%)
      Probs stats: min=0.0000, max=1.0000, mean=0.0270
      Face IDs: min=119742, max=364669, num_faces=364824
      Valid probs shape: (37, 42980)
    ✓ Left (view_id=2): shape (37, 800, 800)
      Valid pixels: 61050/640000 (9.5%)
      Probs stats: min=0.0000, max=1.0000, mean=0.0270
      Face IDs: min=136, max=364823, num_faces=364824
      Valid probs shape: (37, 61050)
    P stats: min=0.0000, max=1.0000, mean=0.0194
    Non-zero vertices: 130641/182414
  ✓ Aggregation complete
  Predicted Labels Distribution:
    Unique pred_raw labels: [ 0  1  2  3  5  6  7  8  9 10 11 12 13 14 15 16 17 18 19 20 21 22 23 24
 25 26 27 28 29 30 31 32 33 34 35]
    Pred label counts: [    0 51773  1501  1396  3902     0  2040  1239  4895  6668]
  Ground Truth Stats:
    Labels shape: (182414,)
    Unique labels: [-1  1  2  3  5  6  7  8  9 10 11 12 13 14 15 16 17 18 19 20 21 22 23 24
 25 26 27 28 29 30 31 32 33 34 35]
    CTab len: 36
  ✓ Raw prediction saved to: /autofs/space/ballarat_004/users/np341/mindboggle2/Colin27-1/pred_conditioned_v2_pytorch3d
  Building vertex adjacency...
  Step 1: Smoothing probabilities (20 iter, α=0.75)...
    Smoothing iteration 0/20...
    Smoothing iteration 5/20...
    Smoothing iteration 10/20...
    Smoothing iteration 15/20...
  ✓ Smoothing complete
  Step 2: MRF refinement (β=0.1)...
    MRF iteration 1/5...
    MRF iteration 2/5...
    MRF iteration 3/5...
  ✓ MRF refinement complete
    Dice calculation debug:
      Pred labels: min=0, max=35, unique=35
      GT labels:   min=-1, max=35, unique=35
      Computed 35 valid scores. Mean: 0.6856
    Dice calculation debug:
      Pred labels: min=1, max=35, unique=34
      GT labels:   min=-1, max=35, unique=35
      Computed 34 valid scores. Mean: 0.8255
    Dice calculation debug:
      Pred labels: min=1, max=35, unique=34
      GT labels:   min=-1, max=35, unique=35
      Computed 34 valid scores. Mean: 0.8256

  RESULTS:
  RAW:         median(top-10)=0.8136, mean(top-10)=0.8244, median(all)=0.7264, mean(all)=0.6856
  + SMOOTHING: median(top-10)=0.9113, mean(top-10)=0.9109, median(all)=0.8579, mean(all)=0.8255 [+0.0977]
  + MRF:       median(top-10)=0.9120, mean(top-10)=0.9111, median(all)=0.8581, mean(all)=0.8256 [+0.0007]
  TOTAL IMPROVEMENT (median top-10): +0.0984

================================================================================
Subject: HLN-12-1
================================================================================
  Step 0: Generating predictions with V2 model...
  Mesh: 138729 vertices, 277454 faces
  Rendering 6 canonical views with PyTorch3D...
  [PyTorch3D] Starting raycasting...
  [PyTorch3D] Using device: cuda:0
  [PyTorch3D] Loading mesh data...
  [PyTorch3D] Mesh: 138729 vertices, 277454 faces
  [PyTorch3D] Uploading mesh to GPU...
  [PyTorch3D] Computing face normals...
  [PyTorch3D] Computing camera matrices...
  [PyTorch3D] Processing 6 views (canonical, no augmentation)...
  [PyTorch3D] Rendering view 1/6: Front... Done! (55392 valid pixels)
  [PyTorch3D] Rendering view 2/6: Bottom... Done! (110033 valid pixels)
  [PyTorch3D] Rendering view 3/6: Top... Done! (101081 valid pixels)
  [PyTorch3D] Rendering view 4/6: Right... Done! (71993 valid pixels)
  [PyTorch3D] Rendering view 5/6: Back... Done! (58637 valid pixels)
  [PyTorch3D] Rendering view 6/6: Left... Done! (75986 valid pixels)
  [PyTorch3D] Raycasting complete!
  Generating predictions for 6 views (one-hot encoded)...
    ✓ Front (view_id=0): shape (37, 800, 800)
      Valid pixels: 55392/640000 (8.7%)
      Probs stats: min=0.0000, max=1.0000, mean=0.0270
      Face IDs: min=0, max=277356, num_faces=277454
      Valid probs shape: (37, 55392)
    ✓ Bottom (view_id=5): shape (37, 800, 800)
      Valid pixels: 110033/640000 (17.2%)
      Probs stats: min=0.0000, max=0.9999, mean=0.0270
      Face IDs: min=4, max=277453, num_faces=277454
      Valid probs shape: (37, 110033)
    ✓ Top (view_id=4): shape (37, 800, 800)
      Valid pixels: 101081/640000 (15.8%)
      Probs stats: min=0.0000, max=0.9999, mean=0.0270
      Face IDs: min=9, max=277285, num_faces=277454
      Valid probs shape: (37, 101081)
    ✓ Right (view_id=3): shape (37, 800, 800)
      Valid pixels: 71993/640000 (11.2%)
      Probs stats: min=0.0000, max=1.0000, mean=0.0270
      Face IDs: min=0, max=277337, num_faces=277454
      Valid probs shape: (37, 71993)
    ✓ Back (view_id=1): shape (37, 800, 800)
      Valid pixels: 58637/640000 (9.2%)
      Probs stats: min=0.0000, max=1.0000, mean=0.0270
      Face IDs: min=14742, max=277439, num_faces=277454
      Valid probs shape: (37, 58637)
    ✓ Left (view_id=2): shape (37, 800, 800)
      Valid pixels: 75986/640000 (11.9%)
      Probs stats: min=0.0000, max=1.0000, mean=0.0270
      Face IDs: min=0, max=277453, num_faces=277454
      Valid probs shape: (37, 75986)
    P stats: min=0.0000, max=1.0000, mean=0.0197
    Non-zero vertices: 100890/138729
  ✓ Aggregation complete
  Predicted Labels Distribution:
    Unique pred_raw labels: [ 0  1  2  3  5  6  7  8  9 10 11 12 13 14 15 16 17 18 19 20 21 22 23 24
 25 26 27 28 29 30 31 32 33 34 35]
    Pred label counts: [    0 37839   701   879  2680     0  1733   742  3749  4983]
  Ground Truth Stats:
    Labels shape: (138729,)
    Unique labels: [-1  1  2  3  5  6  7  8  9 10 11 12 13 14 15 16 17 18 19 20 21 22 23 24
 25 26 27 28 29 30 31 32 33 34 35]
    CTab len: 36
  ✓ Raw prediction saved to: /autofs/space/ballarat_004/users/np341/mindboggle2/HLN-12-1/pred_conditioned_v2_pytorch3d
  Building vertex adjacency...
  Step 1: Smoothing probabilities (20 iter, α=0.75)...
    Smoothing iteration 0/20...
    Smoothing iteration 5/20...
    Smoothing iteration 10/20...
    Smoothing iteration 15/20...
  ✓ Smoothing complete
  Step 2: MRF refinement (β=0.1)...
    MRF iteration 1/5...
    MRF iteration 2/5...
    MRF iteration 3/5...
    MRF iteration 4/5...
  ✓ MRF refinement complete
    Dice calculation debug:
      Pred labels: min=0, max=35, unique=35
      GT labels:   min=-1, max=35, unique=35
      Computed 35 valid scores. Mean: 0.6962
    Dice calculation debug:
      Pred labels: min=1, max=35, unique=34
      GT labels:   min=-1, max=35, unique=35
      Computed 34 valid scores. Mean: 0.8429
    Dice calculation debug:
      Pred labels: min=1, max=35, unique=34
      GT labels:   min=-1, max=35, unique=35
      Computed 34 valid scores. Mean: 0.8432

  RESULTS:
  RAW:         median(top-10)=0.8143, mean(top-10)=0.8188, median(all)=0.7455, mean(all)=0.6962
  + SMOOTHING: median(top-10)=0.9281, mean(top-10)=0.9285, median(all)=0.8733, mean(all)=0.8429 [+0.1138]
  + MRF:       median(top-10)=0.9286, mean(top-10)=0.9289, median(all)=0.8733, mean(all)=0.8432 [+0.0005]
  TOTAL IMPROVEMENT (median top-10): +0.1142

================================================================================
Subject: HLN-12-10
================================================================================
  Step 0: Generating predictions with V2 model...
  Mesh: 134639 vertices, 269274 faces
  Rendering 6 canonical views with PyTorch3D...
  [PyTorch3D] Starting raycasting...
  [PyTorch3D] Using device: cuda:0
  [PyTorch3D] Loading mesh data...
  [PyTorch3D] Mesh: 134639 vertices, 269274 faces
  [PyTorch3D] Uploading mesh to GPU...
  [PyTorch3D] Computing face normals...
  [PyTorch3D] Computing camera matrices...
  [PyTorch3D] Processing 6 views (canonical, no augmentation)...
  [PyTorch3D] Rendering view 1/6: Front... Done! (49208 valid pixels)
  [PyTorch3D] Rendering view 2/6: Bottom... Done! (103318 valid pixels)
  [PyTorch3D] Rendering view 3/6: Top... Done! (96400 valid pixels)
  [PyTorch3D] Rendering view 4/6: Right... Done! (63448 valid pixels)
  [PyTorch3D] Rendering view 5/6: Back... Done! (48636 valid pixels)
  [PyTorch3D] Rendering view 6/6: Left... Done! (67763 valid pixels)
  [PyTorch3D] Raycasting complete!
  Generating predictions for 6 views (one-hot encoded)...
    ✓ Front (view_id=0): shape (37, 800, 800)
      Valid pixels: 49208/640000 (7.7%)
      Probs stats: min=0.0000, max=1.0000, mean=0.0270
      Face IDs: min=0, max=268227, num_faces=269274
      Valid probs shape: (37, 49208)
    ✓ Bottom (view_id=5): shape (37, 800, 800)
      Valid pixels: 103318/640000 (16.1%)
      Probs stats: min=0.0000, max=1.0000, mean=0.0270
      Face IDs: min=33, max=269273, num_faces=269274
      Valid probs shape: (37, 103318)
    ✓ Top (view_id=4): shape (37, 800, 800)
      Valid pixels: 96400/640000 (15.1%)
      Probs stats: min=0.0000, max=1.0000, mean=0.0270
      Face IDs: min=5, max=269228, num_faces=269274
      Valid probs shape: (37, 96400)
    ✓ Right (view_id=3): shape (37, 800, 800)
      Valid pixels: 63448/640000 (9.9%)
      Probs stats: min=0.0000, max=1.0000, mean=0.0270
      Face IDs: min=2, max=269272, num_faces=269274
      Valid probs shape: (37, 63448)
    ✓ Back (view_id=1): shape (37, 800, 800)
      Valid pixels: 48636/640000 (7.6%)
      Probs stats: min=0.0000, max=1.0000, mean=0.0270
      Face IDs: min=90443, max=269273, num_faces=269274
      Valid probs shape: (37, 48636)
    ✓ Left (view_id=2): shape (37, 800, 800)
      Valid pixels: 67763/640000 (10.6%)
      Probs stats: min=0.0000, max=1.0000, mean=0.0270
      Face IDs: min=18, max=269267, num_faces=269274
      Valid probs shape: (37, 67763)
    P stats: min=0.0000, max=1.0000, mean=0.0197
    Non-zero vertices: 98072/134639
  ✓ Aggregation complete
  Predicted Labels Distribution:
    Unique pred_raw labels: [ 0  1  2  3  5  6  7  8  9 10 11 12 13 14 15 16 17 18 19 20 21 22 23 24
 25 26 27 28 29 30 31 32 33 34 35]
    Pred label counts: [    0 36567   854   794  2416     0  1937  1011  4188  3844]
  Ground Truth Stats:
    Labels shape: (134639,)
    Unique labels: [-1  1  2  3  5  6  7  8  9 10 11 12 13 14 15 16 17 18 19 20 21 22 23 24
 25 26 27 28 29 30 31 32 33 34 35]
    CTab len: 36
  ✓ Raw prediction saved to: /autofs/space/ballarat_004/users/np341/mindboggle2/HLN-12-10/pred_conditioned_v2_pytorch3d
  Building vertex adjacency...
  Step 1: Smoothing probabilities (20 iter, α=0.75)...
    Smoothing iteration 0/20...
    Smoothing iteration 5/20...
    Smoothing iteration 10/20...
    Smoothing iteration 15/20...
  ✓ Smoothing complete
  Step 2: MRF refinement (β=0.1)...
    MRF iteration 1/5...
    MRF iteration 2/5...
    MRF iteration 3/5...
  ✓ MRF refinement complete
    Dice calculation debug:
      Pred labels: min=0, max=35, unique=35
      GT labels:   min=-1, max=35, unique=35
      Computed 35 valid scores. Mean: 0.6877
    Dice calculation debug:
      Pred labels: min=1, max=35, unique=34
      GT labels:   min=-1, max=35, unique=35
      Computed 34 valid scores. Mean: 0.8349
    Dice calculation debug:
      Pred labels: min=1, max=35, unique=34
      GT labels:   min=-1, max=35, unique=35
      Computed 34 valid scores. Mean: 0.8352

  RESULTS:
  RAW:         median(top-10)=0.8243, mean(top-10)=0.8268, median(all)=0.7320, mean(all)=0.6877
  + SMOOTHING: median(top-10)=0.9199, mean(top-10)=0.9215, median(all)=0.8726, mean(all)=0.8349 [+0.0956]
  + MRF:       median(top-10)=0.9200, mean(top-10)=0.9217, median(all)=0.8727, mean(all)=0.8352 [+0.0001]
  TOTAL IMPROVEMENT (median top-10): +0.0958

================================================================================
Subject: HLN-12-11
================================================================================
  Step 0: Generating predictions with V2 model...
  Mesh: 130710 vertices, 261416 faces
  Rendering 6 canonical views with PyTorch3D...
  [PyTorch3D] Starting raycasting...
  [PyTorch3D] Using device: cuda:0
  [PyTorch3D] Loading mesh data...
  [PyTorch3D] Mesh: 130710 vertices, 261416 faces
  [PyTorch3D] Uploading mesh to GPU...
  [PyTorch3D] Computing face normals...
  [PyTorch3D] Computing camera matrices...
  [PyTorch3D] Processing 6 views (canonical, no augmentation)...
  [PyTorch3D] Rendering view 1/6: Front... Done! (54132 valid pixels)
  [PyTorch3D] Rendering view 2/6: Bottom... Done! (108773 valid pixels)
  [PyTorch3D] Rendering view 3/6: Top... Done! (99782 valid pixels)
  [PyTorch3D] Rendering view 4/6: Right... Done! (70200 valid pixels)
  [PyTorch3D] Rendering view 5/6: Back... Done! (53644 valid pixels)
  [PyTorch3D] Rendering view 6/6: Left... Done! (73452 valid pixels)
  [PyTorch3D] Raycasting complete!
  Generating predictions for 6 views (one-hot encoded)...
    ✓ Front (view_id=0): shape (37, 800, 800)
      Valid pixels: 54132/640000 (8.5%)
      Probs stats: min=0.0000, max=1.0000, mean=0.0270
      Face IDs: min=0, max=260363, num_faces=261416
      Valid probs shape: (37, 54132)
    ✓ Bottom (view_id=5): shape (37, 800, 800)
      Valid pixels: 108773/640000 (17.0%)
      Probs stats: min=0.0000, max=0.9999, mean=0.0270
      Face IDs: min=9, max=261270, num_faces=261416
      Valid probs shape: (37, 108773)
    ✓ Top (view_id=4): shape (37, 800, 800)
      Valid pixels: 99782/640000 (15.6%)
      Probs stats: min=0.0000, max=1.0000, mean=0.0270
      Face IDs: min=3, max=261118, num_faces=261416
      Valid probs shape: (37, 99782)
    ✓ Right (view_id=3): shape (37, 800, 800)
      Valid pixels: 70200/640000 (11.0%)
      Probs stats: min=0.0000, max=1.0000, mean=0.0270
      Face IDs: min=17, max=260417, num_faces=261416
      Valid probs shape: (37, 70200)
    ✓ Back (view_id=1): shape (37, 800, 800)
      Valid pixels: 53644/640000 (8.4%)
      Probs stats: min=0.0000, max=1.0000, mean=0.0270
      Face IDs: min=8184, max=261302, num_faces=261416
      Valid probs shape: (37, 53644)
    ✓ Left (view_id=2): shape (37, 800, 800)
      Valid pixels: 73452/640000 (11.5%)
      Probs stats: min=0.0000, max=1.0000, mean=0.0270
      Face IDs: min=174, max=261415, num_faces=261416
      Valid probs shape: (37, 73452)
    P stats: min=0.0000, max=1.0000, mean=0.0199
    Non-zero vertices: 96021/130710
  ✓ Aggregation complete
  Predicted Labels Distribution:
    Unique pred_raw labels: [ 0  1  2  3  5  6  7  8  9 10 11 12 13 14 15 16 17 18 19 20 21 22 23 24
 25 26 27 28 29 30 31 32 33 34 35]
    Pred label counts: [    0 34689   737   790  2229     0  1529  1118  3435  4618]
  Ground Truth Stats:
    Labels shape: (130710,)
    Unique labels: [-1  1  2  3  5  6  7  8  9 10 11 12 13 14 15 16 17 18 19 20 21 22 23 24
 25 26 27 28 29 30 31 32 33 34 35]
    CTab len: 36
  ✓ Raw prediction saved to: /autofs/space/ballarat_004/users/np341/mindboggle2/HLN-12-11/pred_conditioned_v2_pytorch3d
  Building vertex adjacency...
  Step 1: Smoothing probabilities (20 iter, α=0.75)...
    Smoothing iteration 0/20...
    Smoothing iteration 5/20...
    Smoothing iteration 10/20...
    Smoothing iteration 15/20...
  ✓ Smoothing complete
  Step 2: MRF refinement (β=0.1)...
    MRF iteration 1/5...
    MRF iteration 2/5...
